### ISSUE TITLE
Add Data message before streaming video

### ISSUE THREAD

**Issue by daveisfera** [apivideo/api.video-reactnative-live-stream#47]
**Is your feature request related to a problem? Please describe.**
Currently, there's no information to define the properties of the video and a Data message can provide that

**Describe the solution you'd like**
Send a Data message with relevant info before streaming the video

**Describe alternatives you've considered**
Not sure there's an alternative to adding this (other than just leaving things as is)

**Additional context**
Here's an example of the info that `ffmpeg` sends when you send a file to an RTMP server:
```
{
    "duration": 0.0,
    "width": 1920.0,
    "height": 1080.0,
    "videodatarate": 0.0,
    "framerate": 24.0,
    "videocodecid": 7.0,
    "audiodatarate": 159.7607421875,
    "audiosamplerate": 44100.0,
    "audiosamplesize": 16.0,
    "stereo": true,
    "audiocodecid": 10.0,
    "major_brand": "qt  ",
    "minor_version": "0",
    "compatible_brands": "qt  ",
    "com.apple.quicktime.creationdate": "2022-04-12T20:24:15-0400",
    "com.apple.quicktime.make": "Apple",
    "com.apple.quicktime.model": "iPhone XR",
    "com.apple.quicktime.software": "15.3.1",
    "encoder": "Lavf59.27.100",
    "filesize": 0.0
}
```

**Comment by ThibaultBee** [comment]
Hi,
I guess your are refering to the `onMetaData` FLV/RTMP message.
On what target have you noticed this? Android or iOS?

The standard does not define all of the fields of your exemple. "com.apple.quicktime.*" are definitely not standard.
I thought nobody use this `onMetaData` message. Why do you need it and what fields?

**Comment by daveisfera** [comment]
Sorry, that was just meant to be an example and not what was required, and yes you're correct the that `com.apple.quicktime.*` values are non-standard and just come from metadata that is added to the file when recorded on an iPhone.
We're currently testing on iOS but will be using Android as well. We use the values like `audiocodecid` and `framerate` to prepare to receive the stream and to optimize handling of the specific config that it's using.
Are you saying that `onMetaData` is something that already exists and that we can use? Or something that could be added? Either way, we'd definitely use it and would love to help add support for it.

**Comment by ThibaultBee** [comment]
I confirmed that `onMetaData` already exists.

**Comment by daveisfera** [comment]
So is that something we can use to send the Data message? Or is that something internal to the library that it would use to send it?

**Comment by ThibaultBee** [comment]
`onMetaData` is the first message that is send in the RTMP stream. It is automatic and internal.

**Comment by daveisfera** [comment]
Do you mean the `connect` message? There's a connect message that contains the following, but not a Data message:
```
{
    "message": "connect",
    "objectEncoding": 0.0,
    "capabilities": 239.0,
    "videoCodecs": 128.0,
    "pageUrl": null,
    "flashVer": "FMLE/3.0 (compatible; FMSc/1.0)",
    "fpad": false,
    "tcUrl": "rtmp://192.168.5.43/test",
    "swfUrl": null,
    "audioCodecs": 1024.0,
    "videoFunction": 1.0
}
```

**Comment by ThibaultBee** [comment]
Hum... sorry, `onMetadata` is the FLV container.
In RTMP, it would be in the `@setDataFrame` packet that contains `onMetadata`.

Here I just captured it with Wireshark for Android:
```
Frame 48: 76 bytes on wire (608 bits), 76 bytes captured (608 bits) on interface en0, id 0
Ethernet II, Src: 56:05:1a:4f:1c:7c (56:05:1a:4f:1c:7c), Dst: Apple_9e:90:ce (5c:52:30:9e:90:ce)
Internet Protocol Version 4, Src: 192.168.1.14, Dst: 192.168.1.12
Transmission Control Protocol, Src Port: 40012, Dst Port: 1935, Seq: 3686, Ack: 3648, Len: 10
[Expert Info (Error/Malformed): Loop in AMF dissection]
Real Time Messaging Protocol (AMF0 Data @setDataFrame())
    RTMP Header
    RTMP Body
        String '@setDataFrame'
            AMF0 type: String (0x02)
            String length: 13
            String: @setDataFrame
        String 'onMetaData'
            AMF0 type: String (0x02)
            String length: 10
            String: onMetaData
        ECMA array (11 items)
            AMF0 type: ECMA array (0x08)
            Array length: 11
            Property 'duration' Number 0
            Property 'videocodecid' Number 7
            Property 'videodatarate' Number 1523
            Property 'width' Number 720
            Property 'height' Number 1280
            Property 'framerate' Number 30
            Property 'audiocodecid' Number 10
            Property 'audiodatarate' Number 128
            Property 'audiosamplerate' Number 44100
            Property 'audiosamplesize' Number 32
            Property 'stereo' Boolean true
            End Of Object Marker
```

**Comment by ThibaultBee** [comment]
For iOS, here is the wireshard captures:
```
Frame 197: 211 bytes on wire (1688 bits), 211 bytes captured (1688 bits) on interface en0, id 0
Ethernet II, Src: b2:65:8a:82:5e:4d (b2:65:8a:82:5e:4d), Dst: Apple_9e:90:ce (5c:52:30:9e:90:ce)
Internet Protocol Version 4, Src: 192.168.1.11, Dst: 192.168.1.12
Transmission Control Protocol, Src Port: 57006, Dst Port: 1935, Seq: 3493, Ack: 3581, Len: 145
[Expert Info (Error/Malformed): Loop in AMF dissection]
Real Time Messaging Protocol (AMF0 Data @setDataFrame())
    RTMP Header
    RTMP Body
        String '@setDataFrame'
            AMF0 type: String (0x02)
            String length: 13
            String: @setDataFrame
        String 'onMetaData'
            AMF0 type: String (0x02)
            String length: 10
            String: onMetaData
        Object (5 items)
            AMF0 type: Object (0x03)
            Property 'width' Number 720
            Property 'videocodecid' Number 7
            Property 'height' Number 1280
            Property 'videodatarate' Number 2000
            Property 'framerate' Number 30
            End Of Object Marker
```

**Comment by daveisfera** [comment]
Oooohhhh! The server is getting the message but the type of the data is different than we expect. This library is sending `AMF0 type` (0x03) but `ffmpeg` and all of the hardware that we've worked with sends `ECMA` (0x08) and our server was silently ignoring it because of this. We'll add handling of this and sorry for the misunderstanding on my end.
